{
  "oclp_version": "0.1.0-draft",
  "kind": "invocation",
  "id": "urn:example:invocation:fraud-score-batch-2026-08-19",
  "annotations": {
    "example.org/purpose": "batch-inference"
  },
  "definition": {
    "id": "urn:example:definition:fraud-score-v4"
  },
  "parameters": {
    "decision_threshold": 0.82,
    "explanation": true
  },
  "inputs": {
    "transactions": [
      {
        "id": "urn:example:artifact:transactions"
      }
    ],
    "model": [
      {
        "id": "urn:example:artifact:risk-model"
      }
    ]
  },
  "requested_outputs": [
    "scores",
    "explanations"
  ]
}
