{
  "annotations": {},
  "definition": {
    "digest": {
      "algorithm": "sha256",
      "value": "6ef1817bfa6744814b8b3c260e0f3913a602d390926a387e64c82af487b8f034"
    },
    "id": "urn:example:definition:uppercase"
  },
  "id": "urn:example:invocation:uppercase-hello",
  "inputs": {
    "source": [
      {
        "digest": {
          "algorithm": "sha256",
          "value": "cd3e37d882123021bdc06767d4f4459d37b7cad67c1f1fd19986d38d59f3dc61"
        },
        "id": "urn:example:artifact:source-document"
      }
    ]
  },
  "kind": "invocation",
  "oclp_version": "0.1.0-draft",
  "outputs": {
    "result": [
      {
        "digest": {
          "algorithm": "sha256",
          "value": "363165abee6413ff5e858b3294d3f1f3baef57184435f99eded4b6fb42c51b36"
        },
        "id": "urn:example:artifact:result-document"
      }
    ]
  },
  "parameters": {
    "locale": "en-US"
  },
  "requested_outputs": [
    "result"
  ]
}
